SourceAudio ID,Title,Catalog,Label,Album,Album Description,Album Release Date,Album Artist,Album Genre,Track Number,Artist,Artist Description,Tempo,BPM,Genre,Cue type,Release Date,Date Uploaded,Length,Description,Keywords,Instruments,Moods,Styles,Lyrics,Has Vocals,Explicit,Has MP3,Has WAV,Publisher 1 Company,Publisher 1 Ownership Share,Publisher 1 Role,Publisher 1 Collection Share Territory 1,Combined Publishers,Writer 1 First Name,Writer 1 Ownership Share,Writer 1 Publishing Interest,Writer 1 Role,Combined Writers
64910190,The Label,shuNai,shuNai Echoes,Virtue's Paradox,"Virtue's Paradox is more than an album; it is a Surgical Audit performed on the nerves of identity. As the definitive manifesto of Acoustic Brutalism, this 14-track record is built from the debris of systemic illusions and personal collapse, moving act-by-act through a deliberate five-part descent.

The Sonic Narrative:
The record transitions from the atmospheric vacuum of Acoustic Noir (The Last Petal) into the ""Chapters of Decay"" (Wolf and Jackal, VALUE$), documenting the disintegration of internal empires through Industrial Rock and Brutal Bap. The journey evolves through Glitch-Folk and nostalgic Retrospective Roots (Secret Notebook) before reaching the ""quiet-loud"" zenith of wreckage and final catharsis in the Dark Carnival of ""Curtain Call"".

The Technical Manifesto:
Driven by the principle of Biological Integrity, the album rejects the sterile perfection of modern production. Every track adheres to the RHA Protocol:

No Pitch Correction: Preserving the natural rasp, vocal fry, and raw emotional breath of the baritone delivery.

Unquantized Dynamics: Utilizing live, ""stumbling"" rhythms and aggressive industrial textures to treat audio as physical architecture.

High-Contrast Density: Achieving ""heaviness"" not through volume, but through the uncompromising density of human truth.

Virtue's Paradox offers a raw, cinematic frame for the disillusioned. It is the sound of a consciousness choosing its own fate amidst the digital dissonance of 2026.",05/28/2026,shuNai,"Alternative Rock, Epic / Hybrid / Trailer, Grunge, Rock, Soundtrack / Orchestral / Score",12,shuNai,"shuNai is a sonic architect and the founder of the Acoustic Brutalism protocol—a movement dedicated to reclaiming biological integrity in the post-AI era. His work is defined by the RHA Protocol (Resonance, Hybridity, Agency), stripping the alternative genre down to a raw, honest core of wood, steel, and human silence.

The shuNai catalog is an expansive ecosystem of ""Cinematic Noir,"" ranging from the aggressive, hybrid textures of Brutal Bap and Industrial Rock to the haunting resonance of Acoustic Noir, Trip-Hop, and Dark Neoclassical arrangements. Each composition serves as a ""Clinical Audit"" of the human condition, navigating the high-tension wires between Moral Sovereignty and Existential Collapse.

Specializing in ""Music for the Disillusioned,"" shuNai delivers high-contrast, unquantized dynamics designed for high-stakes cinematic sync and deep psychological narratives. In a world of digital saturation, his sound is a resolute ""No"" to social compliance—a transcript of a consciousness choosing its own fate.",Medium (90-110 BPM),100,"Alternative Rock, Grunge, Rock",Songs,05/28/2026,04/30/2026,4:33,"A high-octane, cynical Alt-Rock anthem driven by raw irony and gritty frustration. The track features a sharp, sarcastic male vocal that shifts from weary, rhythmic verses to explosive, anthemic grunge shouts in the chorus. Defined by thick, distorted guitars and crushing drums, the production creates a tense, nervous atmosphere reminiscent of 90s/00s post-grunge. It's a relentless, guitar-heavy exploration of betrayal and relationship absurdity, climaxing in a wall of distorted feedback and cathartic anger.","Wasted Time, Betrayal, Heavy Guitars, Raw Vocals, Sarcastic, 90s Revival, Anthemic Chorus, Gritty","Electric Guitar (Distorted), Bass Guitar, Drums, Male Vocals","Angry, Aggressive, Rowdy, Ironic, Cynical","Alt-Rock, Post-Grunge, Post-Punk","Midnight calls, your voice, a widdle bunny's plea
Sweet nothings whispered, meant for only me
The world outside, a blur, a chaotic, passing show
Lost in your digital glow, nowhere else to go

Moved in with just a suitcase, a pawn on your grand board
Believing in a future, a love I could afford
Tasted life drawn from your very soul
Traced your every contour, losing all control

Then many years dissolved like sugar, you sculpted me anew
From a nameless cipher, to someone shining through
A living testament, a trophy you could claim
While I played the part you wrote, fueling your ambition's flame

But oh, the irony, the joke that time will play
Those burning years, those passions, just started to decay!
The vibrant hues all faded, the deep truths turned to rust
Leaving just a label, turning memories to dust!

You asked why months went silent, no spark, no touch, no sign?
I sought cheap solace elsewhere, a different, tangled line
While you looked past the shadows, a narrative you spun
And when you walked away, my very core felt undone!

But oh, the irony, the joke that time will play
Those burning years, those passions, just started to decay!
The vibrant hues all faded, the deep truths turned to rust
Leaving just a label, turning memories to dust!

Came back, then left again, the cycle spun too fast
A year of bitter whispers, futures built to never last
Now decades fade behind us, the vivid colors cease
Just a twisted grin when I see your hard-won, hollow peace
You married ""the gentle touch,"" you sneered, who never fought the fray
While I stand rough and bearded, the strength you threw away
Now he cleans and cooks and whispers, trapped in her command
While she, who craved raw power, got a tightly controlled hand

And oh, the irony, the joke that time will play
Those burning years, those passions, just started to decay!
The vibrant hues all faded, the deep truths turned to rust
Leaving just a label, turning memories to dust!

Then lightning strikes the mind, a question, crude and deep
A memory replaced, secrets I couldn't keep
Did she swallow? Or spit it out? That thought, it makes me reel
So many years we lived as one and all that's left is the
Feel?!",Yes,No,yes,yes,shuNai Echoes,100.00000,Original Publisher,,shuNai Echoes 100%,shuNai,100.00000,shuNai Echoes,"Composer, Writer",shuNai 100%
64910191,Secret Notebook,shuNai,shuNai Echoes,Virtue's Paradox,"Virtue's Paradox is more than an album; it is a Surgical Audit performed on the nerves of identity. As the definitive manifesto of Acoustic Brutalism, this 14-track record is built from the debris of systemic illusions and personal collapse, moving act-by-act through a deliberate five-part descent.

The Sonic Narrative:
The record transitions from the atmospheric vacuum of Acoustic Noir (The Last Petal) into the ""Chapters of Decay"" (Wolf and Jackal, VALUE$), documenting the disintegration of internal empires through Industrial Rock and Brutal Bap. The journey evolves through Glitch-Folk and nostalgic Retrospective Roots (Secret Notebook) before reaching the ""quiet-loud"" zenith of wreckage and final catharsis in the Dark Carnival of ""Curtain Call"".

The Technical Manifesto:
Driven by the principle of Biological Integrity, the album rejects the sterile perfection of modern production. Every track adheres to the RHA Protocol:

No Pitch Correction: Preserving the natural rasp, vocal fry, and raw emotional breath of the baritone delivery.

Unquantized Dynamics: Utilizing live, ""stumbling"" rhythms and aggressive industrial textures to treat audio as physical architecture.

High-Contrast Density: Achieving ""heaviness"" not through volume, but through the uncompromising density of human truth.

Virtue's Paradox offers a raw, cinematic frame for the disillusioned. It is the sound of a consciousness choosing its own fate amidst the digital dissonance of 2026.",05/28/2026,shuNai,"Alternative Rock, Epic / Hybrid / Trailer, Grunge, Rock, Soundtrack / Orchestral / Score",8,shuNai,"shuNai is a sonic architect and the founder of the Acoustic Brutalism protocol—a movement dedicated to reclaiming biological integrity in the post-AI era. His work is defined by the RHA Protocol (Resonance, Hybridity, Agency), stripping the alternative genre down to a raw, honest core of wood, steel, and human silence.

The shuNai catalog is an expansive ecosystem of ""Cinematic Noir,"" ranging from the aggressive, hybrid textures of Brutal Bap and Industrial Rock to the haunting resonance of Acoustic Noir, Trip-Hop, and Dark Neoclassical arrangements. Each composition serves as a ""Clinical Audit"" of the human condition, navigating the high-tension wires between Moral Sovereignty and Existential Collapse.

Specializing in ""Music for the Disillusioned,"" shuNai delivers high-contrast, unquantized dynamics designed for high-stakes cinematic sync and deep psychological narratives. In a world of digital saturation, his sound is a resolute ""No"" to social compliance—a transcript of a consciousness choosing its own fate.",Slow (0-89 BPM),82,"Epic / Hybrid / Trailer, Soundtrack / Orchestral / Score",Songs,05/28/2026,04/30/2026,4:28,"A powerful, high-contrast hybrid score where human fragility meets industrial decay. Features a raw, gravelly male baritone narrating over a bed of warped, pitch-drifting synths and atmospheric digital artifacts. The track evolves from intimate, dry storytelling into a massive, cathedral-sized soundscape. Synthetic percussion, deep sub-bass, and aggressive glitch stutters collide with soaring, youthful choral layers and lush, bitcrushed orchestral strings. A cinematic journey through fragmented memory, defined by heavy tape saturation and overwhelming dynamic shifts.","Cinematic, Hybrid, Dark Folk, Neoclassical, Atmospheric, Ethereal Choir, Glitch, Analog Warp, Emotive, Epic, Memory, Industrial Noir",,"Dark, Epic, Melancholic","Hybrid, Neoclassical, Glitch","In a wooden crib, through a hazy morning
I saw the giants, smiling, softly calling
They were my universe, vast and brightly new
A tiny world unfolding, fresh and true
And a girl with eyes like deep, enchanted pools
Beside me in the quiet, breaking all the rules
We whispered secrets, a love I barely knew
Lost in that moment, me and only you

Oh, the world stretched endlessly, a wonder in my hand
Every day a miracle, in a forgotten land
Where I learned to fly, in vivid, painted dreams
A childhood symphony, bathed in sunlit beams
Taste of berries from the bush, pure laughter, endless skies
Every breath a promise, reflected in my eyes

The crust of fresh-baked bread, a stolen treat on the way
A sweet reward for hunger at the close of every day
Summers at my grandma's, sun-drenched, free, and wild
Exploring hidden river banks, every moment undefiled
The stars, I thought, were close enough to touch
In a secret notebook, my discoveries meant so much
An ancient spinning wheel, silent in the attic's gloom
A life unspoken, a hidden, whispered room

But then one day, walking home through falling snow
A sudden stillness, a truth I came to know
That moment passing, all others on the stream
Would never circle back, a fleeting, waking dream
The birds on winter branches, silent, still, and cold
Just memories now, a story to be told
And I saw her once again, the girl from whispered times
But those deep pools had vanished, changed by passing tides
No recognition in her eyes, a stranger's empty grace
And I just walked on by her, in that lonely, hollow space

Oh, the world stretched endlessly, a wonder in my hand
Every day a miracle, in a forgotten land
Where I learned to fly, in vivid, painted dreams
A childhood symphony, bathed in sunlit beams
Taste of berries from the bush, pure laughter, endless skies
Every breath a promise, reflected in my eyes",Yes,No,yes,yes,shuNai Echoes,100.00000,Original Publisher,,shuNai Echoes 100%,shuNai,100.00000,shuNai Echoes,"Composer, Writer",shuNai 100%
64910192,The Last Petal,shuNai,shuNai Echoes,The Last Petal,,01/26/2026,,"Alternative Rock, Experimental Rock, Indie Rock, Pop Rock",1,shuNai,"shuNai is a sonic architect and the founder of the Acoustic Brutalism protocol—a movement dedicated to reclaiming biological integrity in the post-AI era. His work is defined by the RHA Protocol (Resonance, Hybridity, Agency), stripping the alternative genre down to a raw, honest core of wood, steel, and human silence.

The shuNai catalog is an expansive ecosystem of ""Cinematic Noir,"" ranging from the aggressive, hybrid textures of Brutal Bap and Industrial Rock to the haunting resonance of Acoustic Noir, Trip-Hop, and Dark Neoclassical arrangements. Each composition serves as a ""Clinical Audit"" of the human condition, navigating the high-tension wires between Moral Sovereignty and Existential Collapse.

Specializing in ""Music for the Disillusioned,"" shuNai delivers high-contrast, unquantized dynamics designed for high-stakes cinematic sync and deep psychological narratives. In a world of digital saturation, his sound is a resolute ""No"" to social compliance—a transcript of a consciousness choosing its own fate.",Unspecified,,"Epic / Hybrid / Trailer, Rock, Soundtrack / Orchestral / Score",Songs,01/26/2026,04/30/2026,4:38,"A tragic, cinematic ballad exploring the burden of perfect memory and self-destruction. The track features a weary, intimate baritone delivery that shifts from ghostly whispers to desperate, raw emotional peaks. Atmospheric piano and a ticking clock set a fragile, introspective tone before collapsing into a ""tsunami"" of heavy drums, dissonant synths, and distorted textures during the climax. It is a haunting portrayal of a ""memory casket,"" blending dark cabaret sensibilities with a grand, orchestral-scale finish.","Acoustic Brutalism, Raw Baritone, Memory Casket, Tsunami Effect, Intimate Whisper, Fragile Decay, Industrial Noirm Catharsis, Desperate","Piano, Drums / Percussion, Synth / Sound Design, Male Vocals","Haunting, Introspective, Tragic, Poetic, Cathartic, Dramatically Melancholic","Alternative Rock, Neoclassical, Cinematic Rock, Experimental Pop, Dark Cabaret","I remember the scent of waking skin
Smooth, unmarked by the world's softest hair
A perfect moment, trapped in amber time, I swear
Beyond all present compare
Across the decades, it feels like yesterday
This clarity, it shines and blinds, you see
A phantom limb, a scent that won't decay
A ghost that walks inside of me

And this collected past, so pure, so bright
It builds a world inside my heart
A perfect blueprint, bathed in golden light
Where shadows fear to tread

Oh, this memory's casket, lined with perfect scenes
A flawless echo, chilling to the bone
My gift, my curse, stuck somewhere in between
Forever perfectly alone
A practiced smile hides the silent, deep decay
This heavy heart, where feelings lose their way

New faces bloom, they offer their own light
A different palette, shades I've never known
But in my heart, the past shines ever so bright
On seeds of comparison, wildly sown
It's not their fault if they don't match the gleam
Of moments captured, sealed within a dream

And this collected past, so pure, so bright
It builds a world inside my heart
A perfect blueprint, bathed in golden light
Where shadows fear to tread
Oh, this memory's casket, lined with perfect scenes
A flawless echo, chilling to the bone
My gift, my curse, stuck somewhere in between
Forever perfectly alone
A practiced smile hides the silent, deep decay
This heavy heart, where feelings lose their way

And the colors start to fade, the edges start to fray
This fragile magic burns me, wear me thin
I tear another petal
Just to find a way
To paint this void where life should have been
How many blooms are left? I don't want to know
But keep on tearing, watching the colors go
This broken mirror reflects a fading gleam
And even simple words feel like a mountain I can't stack

Oh, this memory's casket, lined with perfect scenes
A flawless echo, chilling to the bone
My gift, my curse, stuck somewhere in between
Forever perfectly alone
A practiced smile hides the silent, deep decay
This heavy heart, where feelings lose their way

My wishes granted
My own decree
Forever bound
Eternally",Yes,No,yes,yes,shuNai Echoes,,Original Publisher,,shuNai Echoes,shuNai,100.00000,shuNai Echoes,"Composer, Writer",shuNai 100%
64911728,"Thanks, Ballet!!",shuNai,shuNai Echoes,Virtue's Paradox,"Virtue's Paradox is more than an album; it is a Surgical Audit performed on the nerves of identity. As the definitive manifesto of Acoustic Brutalism, this 14-track record is built from the debris of systemic illusions and personal collapse, moving act-by-act through a deliberate five-part descent.

The Sonic Narrative:
The record transitions from the atmospheric vacuum of Acoustic Noir (The Last Petal) into the ""Chapters of Decay"" (Wolf and Jackal, VALUE$), documenting the disintegration of internal empires through Industrial Rock and Brutal Bap. The journey evolves through Glitch-Folk and nostalgic Retrospective Roots (Secret Notebook) before reaching the ""quiet-loud"" zenith of wreckage and final catharsis in the Dark Carnival of ""Curtain Call"".

The Technical Manifesto:
Driven by the principle of Biological Integrity, the album rejects the sterile perfection of modern production. Every track adheres to the RHA Protocol:

No Pitch Correction: Preserving the natural rasp, vocal fry, and raw emotional breath of the baritone delivery.

Unquantized Dynamics: Utilizing live, ""stumbling"" rhythms and aggressive industrial textures to treat audio as physical architecture.

High-Contrast Density: Achieving ""heaviness"" not through volume, but through the uncompromising density of human truth.

Virtue's Paradox offers a raw, cinematic frame for the disillusioned. It is the sound of a consciousness choosing its own fate amidst the digital dissonance of 2026.",05/28/2026,shuNai,"Alternative Rock, Epic / Hybrid / Trailer, Grunge, Rock, Soundtrack / Orchestral / Score",11,shuNai,"shuNai is a sonic architect and the founder of the Acoustic Brutalism protocol—a movement dedicated to reclaiming biological integrity in the post-AI era. His work is defined by the RHA Protocol (Resonance, Hybridity, Agency), stripping the alternative genre down to a raw, honest core of wood, steel, and human silence.

The shuNai catalog is an expansive ecosystem of ""Cinematic Noir,"" ranging from the aggressive, hybrid textures of Brutal Bap and Industrial Rock to the haunting resonance of Acoustic Noir, Trip-Hop, and Dark Neoclassical arrangements. Each composition serves as a ""Clinical Audit"" of the human condition, navigating the high-tension wires between Moral Sovereignty and Existential Collapse.

Specializing in ""Music for the Disillusioned,"" shuNai delivers high-contrast, unquantized dynamics designed for high-stakes cinematic sync and deep psychological narratives. In a world of digital saturation, his sound is a resolute ""No"" to social compliance—a transcript of a consciousness choosing its own fate.",Medium (90-110 BPM),100,"Alternative Rock, Epic / Hybrid / Trailer, Experimental Rock, Hip-Hop / Trap, Rock, World",Songs,05/28/2026,04/30/2026,4:04,"The pioneer track of the Brutal Bap subgenre, blending gritty 90s Boom-Bap rhythms with raw acoustic aggression and haunting Indian folk elements. Featuring a signature raw male baritone with a natural rasp, the track navigates from intimate, introspective verses with sampled sitar and tabla into an explosive industrial climax. The production is defined by a heavy wall of distorted guitars and frantic percussion, creating a visceral sonic journey of emotional resilience and ""Acoustic Brutalism"".","Brutal Bap, Acoustic Brutalism, Sampled Sitar, 90s Hip-Hop, Emotional Climax, Betrayal, Resilience, Raw Vocals, Cultural Fusion, Tense Build-up, No Autotune","Sitar (Sampled), Tabla / Dholak (Indian Percussion), Electric Guitar (Industrial Distortion), Boom-Bap Drums (90s Style), Bass Guitar (Funky/Driving), Male Vocals (Raw Baritone)","Explosive, Intense, Aggressive, Introspective, Uncompromising, Volatile","Brutal Bap, Experimental Industrial, Indian Folk-Hop, Boom-Bap, Alternative Hip-Hop","Yo, she dances on glass, barefoot, tasting the fear
Tomorrow's sharp edges, she knows they'll be near
Still she spins, a phantom smile for the mirror
While the blade waits patient, gleaming with sorrow

And you, with your tongue like a file, rusted razors
Carve me open, just to watch the slow bleed
All my life, you call me less than nothing
Seeds you planted, knowing they'd never grow

How do you choose the poison, huh?
When the cure burns right there in your hands?
How do you reforge the knife, man
And hand it to the one who shattered your plans?

Oh, the wrong fucking thing!
Yeah, you pick it again! Again!
And again! And again!
You crave the pain! You wear the chain!
You find the hurt that screams your name!

Drove through the night, your voice a cold echo
Screaming ""You're done, just give up, lay low!""
She refused the light, you refused the fight
Both of you dancing with shadows, night after night

So I gathered the pieces, set fire to the ground!
Let the beat drop heavy, let the samples resound!
This ain't forgiveness, no, not letting go!
This is remixing your flaws into tracks that I know!

Oh, the wrong fucking thing!
Yeah, you pick it again! Again!
And again! And again!
You crave the pain! You wear the chain!
You find the hurt that screams your name!
Oh, the wrong fucking thing!
You choose it again!
And smile while it destroys your heart!
Don't get it! Never get it!

Oh, the wrong fucking thing!
Yeah choose it again!
And smile while it destroys your heart!
Don't get it! Never get it!

Yeah, wrong choice
Thank you for the blade
Thank you for the silence
Taught me how to play the game",Yes,Yes,yes,yes,shuNai Echoes,100.00000,Original Publisher,,shuNai Echoes 100%,shuNai,100.00000,,"Composer, Writer",shuNai 100%
