SourceAudio ID,Title,Catalog,Label,Album,Album Description,Album Release Date,Album Artist,Album Genre,Track Number,Artist,Artist Description,Tempo,BPM,Genre,Cue type,Release Date,Date Uploaded,Length,Description,Keywords,Instruments,Moods,Styles,Lyrics,Has Vocals,Explicit,Has MP3,Has WAV,Publisher 1 Company,Publisher 1 Ownership Share,Publisher 1 Role,Publisher 1 Collection Share Territory 1,Combined Publishers,Writer 1 First Name,Writer 1 Ownership Share,Writer 1 Publishing Interest,Writer 1 Role,Combined Writers
64952598,"Last Samurai ""No"" (True Brutal)",shuNai,shuNai Echoes,Brutal Bap Origin,"The definitive introduction to Brutal Bap—a high-contrast hybrid genre where the raw grit of 90s Boom-Bap meets industrial friction and aggressive alternative energy. This EP features a sonic spectrum ranging from mid-tempo menacing grooves (90 BPM) to high-octane, relentless industrial assaults (160 BPM). Characterized by percussive ""Biological Integrity,"" the tracks blend traditional rhythmic foundations with sharp, distorted textures and raw, emotive baritone vocals. It is a clinical study of individual sovereignty and urban defiance.",05/14/2026,shuNai,"Alternative Rock, Epic / Hybrid / Trailer, Experimental Rock, Grunge, Hip-Hop / Trap, Rap Metal, Rap Rock",2,shuNai,"shuNai is a sonic architect and the founder of the Acoustic Brutalism protocol—a movement dedicated to reclaiming biological integrity in the post-AI era. His work is defined by the RHA Protocol (Resonance, Hybridity, Agency), stripping the alternative genre down to a raw, honest core of wood, steel, and human silence.

The shuNai catalog is an expansive ecosystem of ""Cinematic Noir,"" ranging from the aggressive, hybrid textures of Brutal Bap and Industrial Rock to the haunting resonance of Acoustic Noir, Trip-Hop, and Dark Neoclassical arrangements. Each composition serves as a ""Clinical Audit"" of the human condition, navigating the high-tension wires between Moral Sovereignty and Existential Collapse.

Specializing in ""Music for the Disillusioned,"" shuNai delivers high-contrast, unquantized dynamics designed for high-stakes cinematic sync and deep psychological narratives. In a world of digital saturation, his sound is a resolute ""No"" to social compliance—a transcript of a consciousness choosing its own fate.",Very Fast (131+ BPM),,"Alternative Rock, Brutal Bap, Epic / Hybrid / Trailer, Experimental Rock, Hip-Hop / Trap, Rap Metal, Rap Rock",Songs,05/14/2026,05/04/2026,3:00,"A high-octane, hyper-aggressive Industrial Metal and Brutal Bap hybrid at a relentless 160 BPM. This version is a sonic assault characterized by machine-gun double-kick drums, frantic high-speed Tabla rolls, and jagged, distorted guitar riffs. The vocal performance features an intense, rapid-fire rhythmic flow that escalates into raw, emotive screaming. It is a clinical document of terminal aggression and high-speed refusal.","Honor, Refusal, Urban grit, Resistance, Dark atmosphere, Heavy groove, Individual sovereignty, Stoicism, Modern samurai, Underground.","Machine-gun Double-Kick Drums, Hyper-fast Tabla, Distorted Analog Bass, Heavy Industrial Guitars, Percussive Noise, Rapid-fire Vocals.","Fast-paced, High-Energy, Menacing, Aggressive, Relentless, Chaotic, Violent, War-mode.","Cinematic Dark Noir., Industrial Hip-Hop, Boom-Bap, Alternative Rock, Nu-Metal","I still look you in the eye!
Even when the world says look away

They crumble like paper when the pressure gets loud
Nodding their heads before the question is out
I could have joined them, swallowed the convenient lie
But silence feels cleaner than a borrowed yes tonight
I don't look away from the man in the glass
I just won't let him wear somebody else's mask

Every yes they choked down leaves another scar
I'd rather bleed honest than pretend who we are

Honor doesn't die while one man still stands
Saying no with his eyes and the weight of his hands
Not for glory, not for praise, not for anyone's crown
Just because bending would burn the last honest thing down

They take what isn't theirs like the world owes them rent
Cross every line like the ground was never meant
No real evil, no hatred, just blind and carefree
They drift through this life like it's all theirs for free
I could have stepped aside, let the moment slip away
But I chose the harder road and kept my own ground to stay

Honor doesn't die while one man still stands
Saying no with his eyes when the whole world demands
Not for glory, not for praise, not for anyone's throne
Just to keep the last piece of myself I can still call my own

They call us fools who fight when the battle's already lost
Last samurai staring down an endless host
Vikings charging straight into the fire and the end
Smiling at death like they're meeting an old friend
You traded your honor just to stay alive one more day
We kept the flame — even if it burns us away
You sold your soul for the comfort of the crowd
We stayed human and that's why we stand proud

Proud! Proud! Proud! Proud!
And that's why we stand proud!
Proud! Proud! Proud! Proud!

Honor doesn't die while one man still stands
Saying ""no"" with his eyes as the kingdom turns to sand
I seek no reward, I chase no borrowed fame
This is the last honest thing I refuse to betray
I'm the last samurai who remembers the code
And my ""no"" is the line where the river won't erode

So look me in the eye
I won't look away
Even if I'm the last one standing here today",Yes,No,yes,yes,shuNai Echoes,100.00000,Original Publisher,,shuNai Echoes 100%,shuNai,100.00000,shuNai Echoes,"Composer, Writer",shuNai 100%
65185779,Wolf and Jackal,shuNai,shuNai Echoes,Wolf and Jackal,,02/12/2026,shuNai,,1,shuNai,"shuNai is a sonic architect and the founder of the Acoustic Brutalism protocol—a movement dedicated to reclaiming biological integrity in the post-AI era. His work is defined by the RHA Protocol (Resonance, Hybridity, Agency), stripping the alternative genre down to a raw, honest core of wood, steel, and human silence.

The shuNai catalog is an expansive ecosystem of ""Cinematic Noir,"" ranging from the aggressive, hybrid textures of Brutal Bap and Industrial Rock to the haunting resonance of Acoustic Noir, Trip-Hop, and Dark Neoclassical arrangements. Each composition serves as a ""Clinical Audit"" of the human condition, navigating the high-tension wires between Moral Sovereignty and Existential Collapse.

Specializing in ""Music for the Disillusioned,"" shuNai delivers high-contrast, unquantized dynamics designed for high-stakes cinematic sync and deep psychological narratives. In a world of digital saturation, his sound is a resolute ""No"" to social compliance—a transcript of a consciousness choosing its own fate.",Unspecified,,"Epic / Hybrid / Trailer, Grunge, Industrial, Rock, Trip-Hop",Songs,02/12/2026,05/12/2026,4:32,"A powerful, narrative-driven fusion of Industrial Grunge and Atmospheric Trip-Hop. The track builds from a weary, spoken-word intro into a monumental, aggressive industrial bridge featuring distorted metallic guitars and raw, breaking vocals. It captures the visceral journey of betrayal and the collapse of an empire—transitioning from somber introspection to explosive, noisy resentment. Ideal for gritty crime dramas, psychological thrillers, and scenes depicting a fall from power or the bitter aftermath of misplaced trust.","Wolf and Jackal, shuNai, Industrial Grunge, Narrative Alternative, Trip-Hop Noir, Cinematic Betrayal, Male Baritone, Spoken Word, Quiet Loud, Distorted Guitar, Metallic Textures, Emotional Peak, Urban Melancholy, Ambition and Fall, Post-Rock Dynamics, Dark Drama Soundtrack","Male Raw Baritone, Distorted Electric Guitar, Dirty Industrial Drums, Ambient Pads, Glitchy Percussion, Deep Bass.","Tense, Introspective, Bitter, Melancholic, Sorrowful, Resolute, Aggressive (Bridge)","Industrial / Grunge / Trip-Hop Fusion, Cinematic Alternative, Narrative Rock","Worth the price?

Worked hard, climbed high
Thought I knew the game
Built my world from scratch
Whispered my own name
Then I gathered wolves
Hungry and so bold
Said, 'We're family now
Stories to be told
Built a little kingdom
On trust and risky bets
Chasing phantom fortunes
Forgetting old regrets

My family, my empire
Built on shifting sand
Thought I was the king
Now I hold out my hand

The money flowed in
The empire would rise
But shadows started growing
Behind their smiling eyes
Wolves and those who funded in the dusk
Their whispers grew loud
Lost in the hustle, lost in the crowd
I built this for us!
Thought we were a team
But some saw my trust
As a vulnerability
It would seem

My family, my empire
Built on shifting sand
Thought I was the king
Now I hold out my hand

The wolves they circled
I thought I was the pack leader
Bold and strong
But then the ground gave way
And the ones I kept close
Oh, where did I go wrong?
The jackals jumped, the pack
They tore me down, I swear
My trusted few, they watched me fall
With empty, hungry stare
They picked the bones of what I built
With cold and grasping hands
My family turned to dust and greed
Scattering on the sands

No, it wasn't worth it
Not this price, not this end
Just a lesson learned, a painful, bitter blend
The empire crumbled
The family turned to dust
All that's left is silence
And the ghost of misplaced trust
And the ghost of misplaced trust

Just quiet roads now
And the echoes in my head
All the spoils they gathered
Was it worth it, little jackals?
Just
What it is
What it is
What it is
What it is",Yes,No,yes,yes,shuNai Echoes,100.00000,Original Publisher,,shuNai Echoes 100%,shuNai,100.00000,shuNai Echoes,"Composer, Writer",shuNai 100%
65185780,Starlight (feat. Chen Mei),shuNai,shuNai Echoes,Virtue's...,,02/26/2026,shuNai,,2,shuNai,"shuNai is a sonic architect and the founder of the Acoustic Brutalism protocol—a movement dedicated to reclaiming biological integrity in the post-AI era. His work is defined by the RHA Protocol (Resonance, Hybridity, Agency), stripping the alternative genre down to a raw, honest core of wood, steel, and human silence.

The shuNai catalog is an expansive ecosystem of ""Cinematic Noir,"" ranging from the aggressive, hybrid textures of Brutal Bap and Industrial Rock to the haunting resonance of Acoustic Noir, Trip-Hop, and Dark Neoclassical arrangements. Each composition serves as a ""Clinical Audit"" of the human condition, navigating the high-tension wires between Moral Sovereignty and Existential Collapse.

Specializing in ""Music for the Disillusioned,"" shuNai delivers high-contrast, unquantized dynamics designed for high-stakes cinematic sync and deep psychological narratives. In a world of digital saturation, his sound is a resolute ""No"" to social compliance—a transcript of a consciousness choosing its own fate.",Unspecified,,"Drama, Metal Ballad, Rock, Soundtrack / Orchestral / Score",Songs,02/26/2026,05/12/2026,4:54,"A devastating Emotional Metal Ballad that serves as the masculine perspective of the ""Virtue's Paradox"" cycle. The track begins with a haunting, minimal arrangement of distorted acoustic guitar and sparse piano, building into a crushing, cathartic metal climax. It tells a raw story of digital vows, thirteen years of haunting silence, and a brutal eventual deception. Featuring a powerful, raspy baritone and ethereal female backing vocals that act as echoes of a lost ideal. Ideal for cinematic scenes of profound regret, tragic endings, and the collapse of a lifelong hope.","Virtue's Starlight, shuNai, Emotional Metal Ballad, Dark Alternative Rock, Tragic Narrative, Lost Soulmate, Profound Regret, Male Baritone, Raspy Vocals, Cathartic Release, Brutal Deception, Cinematic Sorrow, Orchestral Metal, Slow Burn, Virtue's Paradox.","Male Raw Baritone, Distorted Acoustic Guitar, Heavy Bass, Orchestral Metal Drums, Distorted Electric Guitars, Sparse Piano, Ethereal Female Backing Vocals.","Gritty, Powerful, Introspective, Sorrowful, Heartbroken, Devastating",Emotional Metal Ballad / Dark Alternative Rock / Cinematic Narra,"In digital whispers, worlds apart
A glowing screen, a hopeful start
A fleeting name, a flicker in the code
Virtue's Love, I typed
A foolish dream was sowed
Then answered back, a spark so quick
Sure, why not?, my heart did click
A sinner's plea, a whispered dare
Unaware of the burden I would bear

A world away, a spark across the wire
Whispered vows, fueled by digital fire
A shared song echoed, then a fragile thread
Soon distance grew, and words remained unsaid
Your face in photos, hope began to bloom
Then shadows fell, sealing an early doom

A journey's end, a face I longed to see
A stolen month of sun, despite the world's decree
We built our haven, hidden from the storm
A fragile bliss, keeping our spirits warm
Then chilling news, a future turned to grey
A life unborn, fading day by day
A tearful goodbye, a promise in the air
I'll see you soon, a burden hard to bear

Then thirteen years, like seasons turned to stone
A distant ghost, your echo I had known
Until a signal, through the digital haze
Rekindled embers of those bygone days
I chased a phantom, across the land and sea
Bought glittering trinkets, for a fading memory
A fragile reunion, on foreign, hostile ground
The one I loved, no longer could be found

Then came the truth, a sharp and cruel refrain
Virtue's Love shattered by the pouring rain
The promised land, a desert of deceit
With broken vows and futures bittersweet
A child unseen, a price too high to pay
For every sin I carried, day by day
Now only echoes, in this hollow space
A fallen star
Lost without a trace
Lost without a trace",Yes,No,yes,,shuNai Echoes,100.00000,Original Publisher,,shuNai Echoes 100%,shuNai,100.00000,,"Composer, Writer",shuNai 100%
65185781,Void (feat. Chen Mei),shuNai,shuNai Echoes,Virtue's...,,02/26/2026,shuNai,,1,shuNai,"shuNai is a sonic architect and the founder of the Acoustic Brutalism protocol—a movement dedicated to reclaiming biological integrity in the post-AI era. His work is defined by the RHA Protocol (Resonance, Hybridity, Agency), stripping the alternative genre down to a raw, honest core of wood, steel, and human silence.

The shuNai catalog is an expansive ecosystem of ""Cinematic Noir,"" ranging from the aggressive, hybrid textures of Brutal Bap and Industrial Rock to the haunting resonance of Acoustic Noir, Trip-Hop, and Dark Neoclassical arrangements. Each composition serves as a ""Clinical Audit"" of the human condition, navigating the high-tension wires between Moral Sovereignty and Existential Collapse.

Specializing in ""Music for the Disillusioned,"" shuNai delivers high-contrast, unquantized dynamics designed for high-stakes cinematic sync and deep psychological narratives. In a world of digital saturation, his sound is a resolute ""No"" to social compliance—a transcript of a consciousness choosing its own fate.",Unspecified,,"Dark-pop, Drama, Pop, Trip-Hop",Songs,02/26/2026,05/12/2026,4:26,"A melancholic Dark Alternative Pop track and the atmospheric counterpart to ""Virtue's Starlight."" Told from a female perspective, it explores destructive patterns, the fear of control, and the haunting memory of a lost love. The music is defined by slow-tempo atmospheric synths and deep bass, featuring a vulnerable female lead with a male ""ghostly"" echo that provides a counterpoint to her narrative. Incorporates a mix of self-blame and questioning of motivations. Perfect for character studies involving internal conflict, psychological dramas, and stories of emotional estrangement.","Virtue's Void, shuNai, Dark Pop, Alternative Pop, Female Lead, Psychological Drama, Internal Conflict, Melancholic Synth, Deep Bass, Relationship Trauma, Destructive Patterns, Cinematic Noir, Emotional Void, Virtue's Paradox, Atmospheric Soundtrack","Female Lead Vocals, Male Haunting Backing Vocals, Atmospheric Synths, Deep Sub Bass, Electronic Percussion, Minimalist Texture.","Atmospheric, Melancholic, Haunted, Vulnerable, Cynical, Fragile.",Dark Pop / Alternative Pop / Electronic Noir,"That distant year, the world felt new,
I spoke in riddles, hid the real me from you.
A fragile mask, ""empty girl,"" you see,
While coded whispers danced inside of me.

That driving beat, a rebellious sound,
My paper shield, spinning round and round.
I played my game, a dangerous, sweet art,
Hiding the truth, tearing worlds apart…

Then the island's heavy air, thick and gray,
That song stole my choice, turned my world astray.
""I don't wanna miss a thing"", the speakers cried,
Choice... astray...
But I had to choose, where a piece of me died.
A future veiled, a choice that cut so deep,
For virtue's name, so much to keep.
A 'normo' mother? Not in this land.
Just Ang Mo's ghost, beyond your command.

They call me Virtue's Void, ""virtuous"" they say,
But when life feels right, I break the day.
You offer kindness, comfort, gold,
Kindness offered...
And I build walls, a story told
Of breaking things, of pushing hard,
Pushing hard... destroyed...
Leaving every promise scarred.
""Don't interfere,"" I always plead,
Your bitter seed... ""It's my own fault.""
Was it the fear? Was it fear?
Or just the echo, year after year?

Years drift like smoke, you reappear,
A bright, kind ghost, banishing my fear.
Your fear... banished...
You paid my debts, brought diamond light,
While I just drifted, day and night.
Then 'Lah,' so what lah?' this life I led,
Life led... words unsaid...
With other men… the words unsaid.
You saw my fragile hope, my guiding star,
Guiding star... afar...
While real life played out, oh so sad.
It needs protection, safe and true,
Needs to be true...
But Virtue's Void… what can she do?

They call me Virtue's Void, ""virtuous"" they say,
But when life feels right, I break the day.
You offer kindness, comfort, gold,
Kindness offered...
And I build walls, a story told
Of breaking things, of pushing hard,
Pushing hard... destroyed...
Leaving every promise scarred.
""Don't interfere,"" I always plead,
Your bitter seed...
""It's my own fault."" Was it the fear?
Was it fear?
Or just the echo, year after year?

Maybe the ""Ang Mo"" seed you see,
Is just the part that longs to be...
Anything but this control,
This need to shatter, lose my soul.
I protect the weak, I fight their fight,
But lose myself in endless night.

""My son..."" whispered in the dark.
My son... so sad...
""My fault..."" leaving its painful mark.
Your fault...
Virtue's Void... lost and gone.
Void... gone...
Her name... playing on...
Just Her name... fading...",Yes,No,yes,,shuNai Echoes,100.00000,Original Publisher,,shuNai Echoes 100%,shuNai,100.00000,,"Composer, Writer",shuNai 100%
65185782,"Last Samurai's ""No"" (Acoustic)",shuNai,shuNai Echoes,"Last Samurai's ""No"" (Acoustic)",,03/12/2026,shuNai,,1,shuNai,"shuNai is a sonic architect and the founder of the Acoustic Brutalism protocol—a movement dedicated to reclaiming biological integrity in the post-AI era. His work is defined by the RHA Protocol (Resonance, Hybridity, Agency), stripping the alternative genre down to a raw, honest core of wood, steel, and human silence.

The shuNai catalog is an expansive ecosystem of ""Cinematic Noir,"" ranging from the aggressive, hybrid textures of Brutal Bap and Industrial Rock to the haunting resonance of Acoustic Noir, Trip-Hop, and Dark Neoclassical arrangements. Each composition serves as a ""Clinical Audit"" of the human condition, navigating the high-tension wires between Moral Sovereignty and Existential Collapse.

Specializing in ""Music for the Disillusioned,"" shuNai delivers high-contrast, unquantized dynamics designed for high-stakes cinematic sync and deep psychological narratives. In a world of digital saturation, his sound is a resolute ""No"" to social compliance—a transcript of a consciousness choosing its own fate.",Unspecified,,"Chamber Folk, Epic / Hybrid / Trailer, Metal Ballad, Metal Ballad, Soundtrack / Orchestral / Score",Songs,03/12/2026,05/12/2026,5:18,"A hauntingly intimate Acoustic Brutalism anthem with a raw, live-performance aesthetic. The track is built on delicate fingerpicked acoustic guitar and cinematic, swelling cello layers that reach a massive emotional peak, supported by subtle, organic drum work. Featuring a weary yet resolute baritone with natural rasp and vocal fry, the song delivers a powerful narrative of unyielding honor and the refusal to compromise. This ""unplugged"" recording captures a sense of terminal solitude and quiet, dignified defiance. Perfect for cinematic finales, anti-hero character arcs, and high-stakes emotional moments.","Last Samurai's No, shuNai, Acoustic Brutalism, Dark Folk, Unplugged, Cinematic Cello, Chamber Strings, Male Baritone, Raw Emotion, Intimate Performance, Dramatic Build-up, Subtle Live Drums, Organic Percussion, Resolute, Lone Warrior, Moral Defiance.","Male Raw Baritone, Fingerpicked Acoustic Guitar, Deep Cello, Violin, Subtle Live Drums, Soft Percussion.","Gritty, Lonely, Intimate, Honest, Resolute, Defiant, Organic.",Acoustic Brutalism / Chamber Dark Folk / Narrative Cinematic.,"I still look you in the eye
Even when the world says look away

They fold like paper when the pressure gets loud,
Nodding before the question can even come out.
I could've joined them, swallowed the lie,
But silence tastes cleaner than a borrowed ""yes"" tonight.
I don't run from the man staring back in the glass,
I just won't let him wear someone else's mask.

Every ""yes"" they choke down leaves another scar,
I'd rather bleed honest than pretend who we are.

Honor doesn't die while one man still stands,
Saying ""no"" with his eyes and the weight of his hands.
Not for glory, not for praise, not for anyone's crown,
Just because bending would burn the last honest thing down.
I'm the last samurai who remembers the code,
And my ""no"" is the line where the river won't erode.

They take what isn't theirs like the world owes them rent,
Step over lines like the ground was never meant.
No evil, no hatred, just blind and carefree,
They drift through existence like it's all for the taking, not free.
I could've stepped aside, let the moment dissolve,
But I chose the long road — kept my own ground to resolve.

Honor doesn't die while one man still stands,
Saying ""no"" with his eyes and the weight of his hands.
Not for glory, not for praise, not for anyone's crown,
Just because bending would burn the last honest thing down.
I'm the last samurai who remembers the code,
And my ""no"" is the line where the river won't erode.

They call us fools who fight when the battle's already lost,
Last samurai staring down an endless host.
Vikings charging straight into the fire and the end,
Smiling at death like they're meeting an old friend.
You traded your honor just to stay alive one more day,
We kept the flame — even if it burns us away.
You sold your soul for the comfort of the crowd,
We stayed human — and that's why we stand proud.

Honor doesn't die while one man still stands,
Saying ""no"" with his eyes and the weight of his hands.
Not for glory, not for praise, not for anyone's crown,
Just because bending would burn the last honest thing down.
I'm the last samurai who remembers the code,
And my ""no"" is the line where the river won't erode.

So look me in the eye
I won't look away",Yes,No,yes,,shuNai Echoes,100.00000,Original Publisher,,shuNai Echoes 100%,shuNai,100.00000,,"Composer, Writer",shuNai 100%
