SourceAudio ID,Title,Catalog,Label,Album,Album Description,Album Release Date,Album Artist,Album Genre,Track Number,Artist,Artist Description,Tempo,BPM,Genre,Cue type,Release Date,Date Uploaded,Length,Description,Keywords,Instruments,Moods,Styles,Lyrics,Has Vocals,Explicit,Has MP3,Has WAV,Publisher 1 Company,Publisher 1 Ownership Share,Publisher 1 Role,Publisher 1 Collection Share Territory 1,Combined Publishers,Writer 1 First Name,Writer 1 Ownership Share,Writer 1 Publishing Interest,Writer 1 Role,Combined Writers
64916997,Curtain Call,shuNai,shuNai Echoes,Virtue's Paradox,"Virtue's Paradox is more than an album; it is a Surgical Audit performed on the nerves of identity. As the definitive manifesto of Acoustic Brutalism, this 14-track record is built from the debris of systemic illusions and personal collapse, moving act-by-act through a deliberate five-part descent.

The Sonic Narrative:
The record transitions from the atmospheric vacuum of Acoustic Noir (The Last Petal) into the ""Chapters of Decay"" (Wolf and Jackal, VALUE$), documenting the disintegration of internal empires through Industrial Rock and Brutal Bap. The journey evolves through Glitch-Folk and nostalgic Retrospective Roots (Secret Notebook) before reaching the ""quiet-loud"" zenith of wreckage and final catharsis in the Dark Carnival of ""Curtain Call"".

The Technical Manifesto:
Driven by the principle of Biological Integrity, the album rejects the sterile perfection of modern production. Every track adheres to the RHA Protocol:

No Pitch Correction: Preserving the natural rasp, vocal fry, and raw emotional breath of the baritone delivery.

Unquantized Dynamics: Utilizing live, ""stumbling"" rhythms and aggressive industrial textures to treat audio as physical architecture.

High-Contrast Density: Achieving ""heaviness"" not through volume, but through the uncompromising density of human truth.

Virtue's Paradox offers a raw, cinematic frame for the disillusioned. It is the sound of a consciousness choosing its own fate amidst the digital dissonance of 2026.",05/28/2026,shuNai,"Alternative Rock, Epic / Hybrid / Trailer, Grunge, Rock, Soundtrack / Orchestral / Score",13,shuNai,"shuNai is a sonic architect and the founder of the Acoustic Brutalism protocol—a movement dedicated to reclaiming biological integrity in the post-AI era. His work is defined by the RHA Protocol (Resonance, Hybridity, Agency), stripping the alternative genre down to a raw, honest core of wood, steel, and human silence.

The shuNai catalog is an expansive ecosystem of ""Cinematic Noir,"" ranging from the aggressive, hybrid textures of Brutal Bap and Industrial Rock to the haunting resonance of Acoustic Noir, Trip-Hop, and Dark Neoclassical arrangements. Each composition serves as a ""Clinical Audit"" of the human condition, navigating the high-tension wires between Moral Sovereignty and Existential Collapse.

Specializing in ""Music for the Disillusioned,"" shuNai delivers high-contrast, unquantized dynamics designed for high-stakes cinematic sync and deep psychological narratives. In a world of digital saturation, his sound is a resolute ""No"" to social compliance—a transcript of a consciousness choosing its own fate.","Fast (111-130 BPM), Slow (0-89 BPM)",,"Alternative Rock, Dark Ska-Punk, Epic / Hybrid / Trailer, Experimental Rock, Grunge",Songs,05/28/2026,04/30/2026,4:12,"A gritty, cynical fusion of Dark Ska-Punk and explosive Grunge. The track opens with weary, spoken-word verses delivered in a raw, baritone register, punctuated by dissonant, minor-key horn stabs and a driving bassline. It erupts into a high-intensity Alt-Rock chorus with strained, emotional vocals and heavy, distorted guitar riffs. The narrative explores themes of toxic fate and the ""Djinn"" archetype—granting wishes that become cages. Featuring a dramatic, atmospheric bridge and a sarcastic, fading outro, this track is ideal for anti-hero character arcs, dark psychological dramas, or high-stakes cinematic trailers requiring an edgy, non-conformist sound.","Atmosphere: Menacing, Cynical, Weary, Tense, Dark, Aggressive, Sarcastic, Dissonant, Unsettling, Gritty. Narrative: Betrayal, Anti-hero, Psychological, Obsession, Irony, Villain Origin, Toxic, Urban, Industrial, Underground.. Energy: Driving, Urgent, Explosive, Volatile, High-Intensity, Raw, Strained, Frantic. Themes: Djinn, Forbidden Wishes, Mirror Identity, Modern Ruin, Broken Trust, Psychological Thriller.","Male Raw Baritone, Dissonant Horns, Heavy Distorted Guitars, Driving Bass, Energetic Punk Drums, Distorted Synths","Urgent, Melancholic, Weary, Cynical, Aggressively Sarcastic, Anti-festive","Spoken Word, Intense Delivery., Aggressive Roar, Vocal Fry, Natural Rasp, Raw Emotional, Vocal Style: Male Baritone, Brass Punk., Sub-Styles: Post-Punk, Industrial Rock., Primary Styles: Dark Ska-Punk, Cinematic Rock, Grunge, Alternative Rock, Epic Hybrid, Experimental Rock","Saw the world outside in crisis, spinning into dust
While you dreamt of romance on some far-off, sun-kissed shore
Tears at the airport, promising eternal trust
Destroying all your notions of what men are truly for
It's a start, that whispered longing
The shadow of a choice you made, a tremor you can't shake
No turning back the clock, just for your own safe sake

Then comes the hunger for something more primal
And the brute you wished for, smashing walls with primal might
Bringing home the spoils, but wild, beyond the light
He'll fight your every battle, till he's bled out on the floor
'Cause that kind of raw power needs acres, not less

I'm the djinn inside the bottle
This is my damn fate!
Granting your true wishes
Sealing your own gate!
Don't blame the mirror
When you see what you desire!
Burning from the inside out
Fueling your own fire!
Oh yeah!
At the price of your own soul!

Wanted proof the bastards run, designed to cheat and flee?
You got it!
Manipulations, elegant and grim
A masterclass in poison, served precisely, just for thee
Enjoy the validation, though madness starts to swim
""Of course, he's just like others!"" – Yeah, you got your evidence
Young and sick with paranoia, losing common sense

Or maybe you called for Santa, the man who fixes all
Or Santa Claus arrived, with cash to build your dream
Paid off the debts, erased the past, a never-ending stream
He's perfect, reads your mind, calls you his queen for years
But perfect's got a poison, it drowns you in your fears

I'm the djinn inside the bottle
This is my damn fate!
Granting your true wishes
Sealing your own gate!
Don't blame the mirror
When you see what you desire!
Burning from the inside out
Fueling your own fire!
Oh yeah!
At the price of your own soul!

You look into the glass
And who do you really see?
The monster? Or the victim?
The twisted destiny?
I give you what you hunger
What you truly need to know
But when the wish's granted
You forget how to let go
You forget how to let go!

So, who's next in line?
Whose secret will I pry?
Go on, make a whisper
Or maybe just a sigh
The bottle's empty now
But I'm still here, you know
Waiting, watching
Ready for the show
Ready for the show!",Yes,No,yes,yes,shuNai Echoes,100.00000,Administrator,,shuNai Echoes 100%,shuNai,100.00000,,"Composer, Writer",shuNai 100%
64952595,"Thanks, Ballet!!",shuNai,shuNai Echoes,Brutal Bap Origin,"The definitive introduction to Brutal Bap—a high-contrast hybrid genre where the raw grit of 90s Boom-Bap meets industrial friction and aggressive alternative energy. This EP features a sonic spectrum ranging from mid-tempo menacing grooves (90 BPM) to high-octane, relentless industrial assaults (160 BPM). Characterized by percussive ""Biological Integrity,"" the tracks blend traditional rhythmic foundations with sharp, distorted textures and raw, emotive baritone vocals. It is a clinical study of individual sovereignty and urban defiance.",05/14/2026,shuNai,"Alternative Rock, Epic / Hybrid / Trailer, Experimental Rock, Grunge, Hip-Hop / Trap, Rap Metal, Rap Rock",3,shuNai,"shuNai is a sonic architect and the founder of the Acoustic Brutalism protocol—a movement dedicated to reclaiming biological integrity in the post-AI era. His work is defined by the RHA Protocol (Resonance, Hybridity, Agency), stripping the alternative genre down to a raw, honest core of wood, steel, and human silence.

The shuNai catalog is an expansive ecosystem of ""Cinematic Noir,"" ranging from the aggressive, hybrid textures of Brutal Bap and Industrial Rock to the haunting resonance of Acoustic Noir, Trip-Hop, and Dark Neoclassical arrangements. Each composition serves as a ""Clinical Audit"" of the human condition, navigating the high-tension wires between Moral Sovereignty and Existential Collapse.

Specializing in ""Music for the Disillusioned,"" shuNai delivers high-contrast, unquantized dynamics designed for high-stakes cinematic sync and deep psychological narratives. In a world of digital saturation, his sound is a resolute ""No"" to social compliance—a transcript of a consciousness choosing its own fate.",Medium (90-110 BPM),,"Alternative Rock, Boom-Bap, Brutal Bap, Epic / Hybrid / Trailer, Experimental Rock, Hip-Hop / Trap, Rock, World",Songs,05/14/2026,05/04/2026,4:04,"The pioneer track of the Brutal Bap subgenre, blending gritty 90s Boom-Bap rhythms with raw acoustic aggression and haunting Indian folk elements. Featuring a signature raw male baritone with a natural rasp, the track navigates from intimate, introspective verses with sampled sitar and tabla into an explosive industrial climax. The production is defined by a heavy wall of distorted guitars and frantic percussion, creating a visceral sonic journey of emotional resilience and ""Acoustic Brutalism"".","Brutal Bap, Acoustic Brutalism, Sampled Sitar, 90s Hip-Hop, Emotional Climax, Betrayal, Resilience, Raw Vocals, Cultural Fusion, Tense Build-up, No Autotune","Sitar (Sampled), Tabla / Dholak (Indian Percussion), Electric Guitar (Industrial Distortion), Boom-Bap Drums (90s Style), Bass Guitar (Funky/Driving), Male Vocals (Raw Baritone)","Explosive, Intense, Aggressive, Introspective, Uncompromising, Volatile","Alternative Hip-Hop, Brutal Bap, Boom-Bap, Indian Folk-Hop, Experimental Industrial","Yo, she dances on glass, barefoot, tasting the fear
Tomorrow's sharp edges, she knows they'll be near
Still she spins, a phantom smile for the mirror
While the blade waits patient, gleaming with sorrow

And you, with your tongue like a file, rusted razors
Carve me open, just to watch the slow bleed
All my life, you call me less than nothing
Seeds you planted, knowing they'd never grow

How do you choose the poison, huh?
When the cure burns right there in your hands?
How do you reforge the knife, man
And hand it to the one who shattered your plans?

Oh, the wrong fucking thing!
Yeah, you pick it again! Again!
And again! And again!
You crave the pain! You wear the chain!
You find the hurt that screams your name!

Drove through the night, your voice a cold echo
Screaming""You're done, just give up, lay low!""
She refused the light, you refused the fight
Both of you dancing with shadows, night after night

So I gathered the pieces, set fire to the ground!
Let the beat drop heavy, let the samples resound!
This ain't forgiveness, no, not letting go!
This is remixing your flaws into tracks that I know!

Oh, the wrong fucking thing!
Yeah, you pick it again! Again!
And again! And again!
You crave the pain! You wear the chain!
You find the hurt that screams your name!

Oh, the wrong fucking thing!
You choose it again!
And smile while it destroys your heart!
Don't get it! Never get it!

Oh, the wrong fucking thing!
You choose it again!
And smile while it destroys your heart!
Don't get it! Never get it!

Yeah, wrong choice
Thank you for the blade
Thank you for the silence
Taught me how to play
The game",Yes,Yes,yes,yes,shuNai Echoes,100.00000,Original Publisher,,shuNai Echoes 100%,shuNai,100.00000,shuNai Echoes,"Composer, Writer",shuNai 100%
64952596,P.S. Mentol Spit,shuNai,shuNai Echoes,Brutal Bap Origin,"The definitive introduction to Brutal Bap—a high-contrast hybrid genre where the raw grit of 90s Boom-Bap meets industrial friction and aggressive alternative energy. This EP features a sonic spectrum ranging from mid-tempo menacing grooves (90 BPM) to high-octane, relentless industrial assaults (160 BPM). Characterized by percussive ""Biological Integrity,"" the tracks blend traditional rhythmic foundations with sharp, distorted textures and raw, emotive baritone vocals. It is a clinical study of individual sovereignty and urban defiance.",05/14/2026,shuNai,"Alternative Rock, Epic / Hybrid / Trailer, Experimental Rock, Grunge, Hip-Hop / Trap, Rap Metal, Rap Rock",4,shuNai,"shuNai is a sonic architect and the founder of the Acoustic Brutalism protocol—a movement dedicated to reclaiming biological integrity in the post-AI era. His work is defined by the RHA Protocol (Resonance, Hybridity, Agency), stripping the alternative genre down to a raw, honest core of wood, steel, and human silence.

The shuNai catalog is an expansive ecosystem of ""Cinematic Noir,"" ranging from the aggressive, hybrid textures of Brutal Bap and Industrial Rock to the haunting resonance of Acoustic Noir, Trip-Hop, and Dark Neoclassical arrangements. Each composition serves as a ""Clinical Audit"" of the human condition, navigating the high-tension wires between Moral Sovereignty and Existential Collapse.

Specializing in ""Music for the Disillusioned,"" shuNai delivers high-contrast, unquantized dynamics designed for high-stakes cinematic sync and deep psychological narratives. In a world of digital saturation, his sound is a resolute ""No"" to social compliance—a transcript of a consciousness choosing its own fate.",Fast (111-130 BPM),,"Alternative Rock, Boom-Bap, Brutal Bap, Grunge, Hip-Hop / Trap, Rock",Songs,05/14/2026,05/04/2026,3:20,"A high-energy, hybrid track blending 90s Boom-Bap hip-hop with aggressive old-school Punk and Grunge. The track features a dynamic structure, starting with a gritty, mid-tempo hip-hop groove (92 BPM) driven by a funky bassline and crisp vinyl-crackling drums. It violently transitions into explosive, high-octane Punk choruses (135 BPM) with heavy distorted power-chord guitars and slamming live drums. Features a raw, gravelly male baritone vocal with an intense, sarcastic delivery and powerful snarls.","Urban decay, Street grit, Rebellion, High energy, Hybrid, Raw vocals, Dark atmosphere, Conflict, Transformation.","Electric Guitar (Distorted/Overdrive), Bass Guitar (Analog/Dirty), Drums (Acoustic/Slamming), Tabla, Piano (Stabs), Vinyl Crackle.","Energetic, Gritty, Raw, Tense, Aggressive, Rebellious, Sarcastic, Defiant.","Industrial Hip-Hop, Boom-Bap, Grunge, Alternative Rock., Punk Rock, Nu-Metal","They turn off the light
They turn off the light
And I'm still burning
They turn off the light
They turn off the light
And I'm still burning

Eyes like dead fish on a market stall
Bubblegum for the brain — their holy call
Credits, kids, Netflix on repeat
Chew the lie, feel the beat
Mirror's a stranger they refuse to meet
I still catch sunsets in dirty glass
Like it's the first time — and it lasts
They're ""grown-ups"", I'm ""immature""
Yeah, chew and spit, you poor

Why run the race when the finish line's a lie?
Why bleed for glory when the glory's already dry?

Turn off the light, you fool!
You already did!
Turn off the light, you fool!
It's easier to live like this!
Turn off the light, you fool!
No more feeling, no more fight
Turn off the light, you fool!
Or are you already out of light?

She was fire, claws out, smile like a blade
Ripped me open just to watch the shade
Ten years later — tired mom, office drone
No spark left, just scrolling on her phone
The venom's gone, the thrill's deceased
She traded fangs for a mortgage lease
I kept the scars, I kept the flame
She chose the cage — I kept the game

Turn off the light, you fool!
Yeah, you already did!
Turn off the light, you fool!
Hide behind your fucking lid!
Turn off the light, you fool!
Kill the spark, kill the fight
Turn off the light, you fool!
Tell me — are you still alive inside?

They say I'm immature
I say I'm still breathing
They dim the light
I breathe the air full chest
Rat in the sewer?
Fine — at least I feel the stench
They hold their breath
I inhale the mess
Not today
Not yet

Turn off the light, you fool!
I'm still burning bright!
Turn off the light, you fool!
I'm still alive tonight!
Turn off the light, you fool!
You can't kill what's inside!
Turn off the light, you fool!
I'm still fucking alive!

Not today
Not yet
I'm still breathing",Yes,Yes,yes,yes,shuNai Echoes,100.00000,Original Publisher,,shuNai Echoes 100%,shuNai,100.00000,shuNai Echoes,"Composer, Writer",shuNai 100%
64952597,"Last Samurai's ""No""",shuNai,shuNai Echoes,Brutal Bap Origin,"The definitive introduction to Brutal Bap—a high-contrast hybrid genre where the raw grit of 90s Boom-Bap meets industrial friction and aggressive alternative energy. This EP features a sonic spectrum ranging from mid-tempo menacing grooves (90 BPM) to high-octane, relentless industrial assaults (160 BPM). Characterized by percussive ""Biological Integrity,"" the tracks blend traditional rhythmic foundations with sharp, distorted textures and raw, emotive baritone vocals. It is a clinical study of individual sovereignty and urban defiance.",05/14/2026,shuNai,"Alternative Rock, Epic / Hybrid / Trailer, Experimental Rock, Grunge, Hip-Hop / Trap, Rap Metal, Rap Rock",1,shuNai,"shuNai is a sonic architect and the founder of the Acoustic Brutalism protocol—a movement dedicated to reclaiming biological integrity in the post-AI era. His work is defined by the RHA Protocol (Resonance, Hybridity, Agency), stripping the alternative genre down to a raw, honest core of wood, steel, and human silence.

The shuNai catalog is an expansive ecosystem of ""Cinematic Noir,"" ranging from the aggressive, hybrid textures of Brutal Bap and Industrial Rock to the haunting resonance of Acoustic Noir, Trip-Hop, and Dark Neoclassical arrangements. Each composition serves as a ""Clinical Audit"" of the human condition, navigating the high-tension wires between Moral Sovereignty and Existential Collapse.

Specializing in ""Music for the Disillusioned,"" shuNai delivers high-contrast, unquantized dynamics designed for high-stakes cinematic sync and deep psychological narratives. In a world of digital saturation, his sound is a resolute ""No"" to social compliance—a transcript of a consciousness choosing its own fate.",Medium (90-110 BPM),,"Alternative Rock, Brutal Bap, Epic / Hybrid / Trailer, Experimental Rock, Hip-Hop / Trap, Rock",Songs,05/14/2026,05/04/2026,4:41,"A heavy, atmospheric hybrid track blending gritty 90s Boom-Bap rhythms with dark industrial elements. The track is built on a monolithic groove with punchy analog bass, sharp snares, and a hypnotic guitar hook. Features a raw, gravelly male baritone vocal with a cynical, rhythmic flow that transitions into powerful, gritty shouting. The mood is menacing and resolute, representing a final stand of individual sovereignty.","Honor, Refusal, Urban grit, Resistance, Dark atmosphere, Heavy groove, Individual sovereignty, Stoicism, Modern samurai, Underground.","Electric Guitar (Chunky/Palm-muted), Analog Bass (Distorted), Drums (90s Boom-Bap style), Tabla, Industrial Noise, Vinyl Crackle.","Gritty, Heavy, Menacing, Dark, Tense, Resolute, Defiant, Confident.","Nu-Metal, Alternative Rock, Boom-Bap, Industrial Hip-Hop, Cinematic Dark Noir.","I still look you in the eye
Even when the world says look away

They crumble like paper when the pressure gets loud
Nodding their heads before the question is out
I could've joined them, swallowed the convenient lie
But silence feels cleaner than a borrowed ""yes"" tonight
I don't look away from the man in the glass
I just won't let him wear somebody else's mask

Every ""yes"" they choke down leaves another scar
I'd rather bleed honest than pretend who we are

Honor doesn't die while one man still stands
Saying ""no"" with his eyes and the weight of his hands
Not for glory, not for praise, not for anyone's crown
Just because bending would burn the last honest thing down

They take what isn't theirs like the world owes them rent
Cross every line like the ground was never meant
No real evil, no hatred, just blind and carefree
They drift through this life like it's all theirs for free
I could've stepped aside, let the moment slip away
But I chose the harder road — and kept my own ground to stay

Honor doesn't die while one man still stands
Saying ""no"" with his eyes when the whole world demands
Not for glory, not for praise, not for anyone's throne
Just to keep the last piece of myself I can still call my own

They call us fools who fight when the battle's already lost
Last samurai staring down an endless host
Vikings charging straight into the fire and the end
Smiling at death like they're meeting an old friend
You traded your honor just to stay alive one more day
We kept the flame — even if it burns us away
You sold your soul for the comfort of the crowd
We stayed human and that's why we stand proud

Honor doesn't die while one man still stands
Saying ""no"" with his eyes as the kingdom turns to sand
I seek no reward, I chase no borrowed fame
This is the last honest thing I refuse to betray
I'm the last samurai who remembers the code
And my ""no"" is the line where the river won't erode

So look me in the eye
I won't look away
Even if I'm the last one standing here today",Yes,No,yes,yes,shuNai Echoes,100.00000,Original Publisher,,shuNai Echoes 100%,shuNai,100.00000,shuNai Echoes,"Composer, Writer",shuNai 100%
