SourceAudio ID,Title,Catalog,Label,Album,Album Description,Album Release Date,Album Artist,Album Genre,Track Number,Artist,Artist Description,Tempo,BPM,Genre,Cue type,Release Date,Date Uploaded,Length,Description,Keywords,Instruments,Moods,Styles,Lyrics,Has Vocals,Explicit,Has MP3,Has WAV,Publisher 1 Company,Publisher 1 Ownership Share,Publisher 1 Role,Publisher 1 Collection Share Territory 1,Combined Publishers,Writer 1 First Name,Writer 1 Ownership Share,Writer 1 Publishing Interest,Writer 1 Role,Combined Writers
65187117,Virtue: Void (feat. Chen Mei),shuNai,shuNai Echoes,Virtue's Paradox,"Virtue's Paradox is more than an album; it is a Surgical Audit performed on the nerves of identity. As the definitive manifesto of Acoustic Brutalism, this 14-track record is built from the debris of systemic illusions and personal collapse, moving act-by-act through a deliberate five-part descent.

The Sonic Narrative:
The record transitions from the atmospheric vacuum of Acoustic Noir (The Last Petal) into the ""Chapters of Decay"" (Wolf and Jackal, VALUE$), documenting the disintegration of internal empires through Industrial Rock and Brutal Bap. The journey evolves through Glitch-Folk and nostalgic Retrospective Roots (Secret Notebook) before reaching the ""quiet-loud"" zenith of wreckage and final catharsis in the Dark Carnival of ""Curtain Call"".

The Technical Manifesto:
Driven by the principle of Biological Integrity, the album rejects the sterile perfection of modern production. Every track adheres to the RHA Protocol:

No Pitch Correction: Preserving the natural rasp, vocal fry, and raw emotional breath of the baritone delivery.

Unquantized Dynamics: Utilizing live, ""stumbling"" rhythms and aggressive industrial textures to treat audio as physical architecture.

High-Contrast Density: Achieving ""heaviness"" not through volume, but through the uncompromising density of human truth.

Virtue's Paradox offers a raw, cinematic frame for the disillusioned. It is the sound of a consciousness choosing its own fate amidst the digital dissonance of 2026.",05/28/2026,shuNai,"Alternative Rock, Epic / Hybrid / Trailer, Grunge, Rock, Soundtrack / Orchestral / Score",4,shuNai,"shuNai is a sonic architect and the founder of the Acoustic Brutalism protocol—a movement dedicated to reclaiming biological integrity in the post-AI era. His work is defined by the RHA Protocol (Resonance, Hybridity, Agency), stripping the alternative genre down to a raw, honest core of wood, steel, and human silence.

The shuNai catalog is an expansive ecosystem of ""Cinematic Noir,"" ranging from the aggressive, hybrid textures of Brutal Bap and Industrial Rock to the haunting resonance of Acoustic Noir, Trip-Hop, and Dark Neoclassical arrangements. Each composition serves as a ""Clinical Audit"" of the human condition, navigating the high-tension wires between Moral Sovereignty and Existential Collapse.

Specializing in ""Music for the Disillusioned,"" shuNai delivers high-contrast, unquantized dynamics designed for high-stakes cinematic sync and deep psychological narratives. In a world of digital saturation, his sound is a resolute ""No"" to social compliance—a transcript of a consciousness choosing its own fate.",Unspecified,,"Dark-pop, Drama, Pop, Trip-Hop",Songs,05/28/2026,05/12/2026,4:20,"A melancholic Dark Alternative Pop track and the atmospheric counterpart to ""Virtue: Starlight."" This remastered version, featuring revised lyrics, explores destructive patterns and the fear of control through the female perspective of the ""Virtue's Paradox"" cycle. Defined by slow-tempo atmospheric synths and deep sub-bass with a ""ghostly"" male echo. Perfect for psychological dramas and character studies of emotional estrangement.","Virtue's Paradox Album, Remastered, Revised Lyrics, 
Virtue's Void, shuNai, Dark Pop, Alternative Pop, Female Lead, Psychological Drama, Internal Conflict, Melancholic Synth, Deep Bass, Relationship Trauma, Destructive Patterns, Cinematic Noir, Emotional Void, Virtue's Paradox, Atmospheric Soundtrack","Female Lead Vocals, Male Haunting Backing Vocals, Atmospheric Synths, Deep Sub Bass, Electronic Percussion, Minimalist Texture.","Atmospheric, Melancholic, Haunted, Vulnerable, Cynical, Fragile.",Dark Pop / Alternative Pop / Electronic Noir,"That distant year, the world felt new
I spoke in riddles, hid the real me from you
A fragile mask, ""empty girl,"" you see
While coded whispers danced inside of me
That driving beat, a rebellious sound
My paper shield, spinning round and round
I played my game, a dangerous, sweet art
Hiding the truth, tearing worlds apart…

Then the island's heavy air, thick and gray
That song stole my choice, turned my world astray
""I don't wanna miss a thing,"" the speakers cried
Choice
Astray
But I had to choose, where a piece of me died
A future veiled, a choice that cut so deep
For virtue's name, so much to keep
A 'normo' mother? Not in this land
Just Ang Mo's ghost, beyond your command

They call me Virtue's Void, ""virtuous"" they say
But when life feels right, I break the day
You offer kindness, comfort, gold
Kindness offered
And I build walls, a story told
Of breaking things, of pushing hard
Pushing hard
Destroyed
Leaving every promise scarred
""Don't interfere,"" I always plead
Your bitter seed
""It's my own fault."" Was it the fear?
Was it fear?
Or just the echo, year after year?

Years drift like smoke, you reappear
A bright, kind ghost, banishing my fear
Your fear
Banished You paid my debts, brought diamond light
While I just drifted, day and night
Then 'Lah,' so what lah?' this life I led
Life led
Words unsaid
With other men
The words unsaid
You saw my fragile hope, my guiding star
Guiding star
Afar While real life played out, oh so sad
It needs protection, safe and true
Needs to be true
But Virtue's Void… what can she do?

They call me Virtue's Void, ""virtuous"" they say
But when life feels right, I break the day
Break the day
You offer kindness, comfort, gold
Kindness offered
And I build walls, a story told
Of breaking things, of pushing hard
Pushing hard
Destroyed
Leaving every promise scarred
""Don't interfere,"" I always plead
Your bitter seed
""It's my own fault."" Was it the fear?
Was it fear?
Or just the echo, year after year?

Maybe the ""Ang Mo"" seed you see
Is just the part that longs to be
Anything but this control
This need to shatter, lose my soul
I protect the weak, I fight their fight
But lose myself in endless night

""My son..."" Whispered in the dark
My son So sad ""My fault..."" Leaving its painful mark
Your fault
Virtue's Void
Lost and gone
Void Gone Her name Pplaying on
Playing on
Just Her name
Fading",Yes,No,yes,yes,shuNai Echoes,100.00000,Original Publisher,,shuNai Echoes 100%,shuNai,100.00000,shuNai Echoes,"Composer, Writer",shuNai 100%
65187118,Experiment 93 (feat. Chen Mei),shuNai,shuNai Echoes,Virtue's Paradox,"Virtue's Paradox is more than an album; it is a Surgical Audit performed on the nerves of identity. As the definitive manifesto of Acoustic Brutalism, this 14-track record is built from the debris of systemic illusions and personal collapse, moving act-by-act through a deliberate five-part descent.

The Sonic Narrative:
The record transitions from the atmospheric vacuum of Acoustic Noir (The Last Petal) into the ""Chapters of Decay"" (Wolf and Jackal, VALUE$), documenting the disintegration of internal empires through Industrial Rock and Brutal Bap. The journey evolves through Glitch-Folk and nostalgic Retrospective Roots (Secret Notebook) before reaching the ""quiet-loud"" zenith of wreckage and final catharsis in the Dark Carnival of ""Curtain Call"".

The Technical Manifesto:
Driven by the principle of Biological Integrity, the album rejects the sterile perfection of modern production. Every track adheres to the RHA Protocol:

No Pitch Correction: Preserving the natural rasp, vocal fry, and raw emotional breath of the baritone delivery.

Unquantized Dynamics: Utilizing live, ""stumbling"" rhythms and aggressive industrial textures to treat audio as physical architecture.

High-Contrast Density: Achieving ""heaviness"" not through volume, but through the uncompromising density of human truth.

Virtue's Paradox offers a raw, cinematic frame for the disillusioned. It is the sound of a consciousness choosing its own fate amidst the digital dissonance of 2026.",05/28/2026,shuNai,"Alternative Rock, Epic / Hybrid / Trailer, Grunge, Rock, Soundtrack / Orchestral / Score",9,shuNai,"shuNai is a sonic architect and the founder of the Acoustic Brutalism protocol—a movement dedicated to reclaiming biological integrity in the post-AI era. His work is defined by the RHA Protocol (Resonance, Hybridity, Agency), stripping the alternative genre down to a raw, honest core of wood, steel, and human silence.

The shuNai catalog is an expansive ecosystem of ""Cinematic Noir,"" ranging from the aggressive, hybrid textures of Brutal Bap and Industrial Rock to the haunting resonance of Acoustic Noir, Trip-Hop, and Dark Neoclassical arrangements. Each composition serves as a ""Clinical Audit"" of the human condition, navigating the high-tension wires between Moral Sovereignty and Existential Collapse.

Specializing in ""Music for the Disillusioned,"" shuNai delivers high-contrast, unquantized dynamics designed for high-stakes cinematic sync and deep psychological narratives. In a world of digital saturation, his sound is a resolute ""No"" to social compliance—a transcript of a consciousness choosing its own fate.",Unspecified,,"Alternative Rock, Brutal Bap, Epic / Hybrid / Trailer, Skate-Punk, Trip-Hop",Songs,05/28/2026,05/12/2026,4:21,"A nostalgic and high-energy Trip-Hop / Skate-Punk hybrid that captures the essence of youthful rebellion and hidden identity. The track opens with a confident, intimate female vocal over driving trip-hop beats and deep sub-bass, building a cool, atmospheric tension. In a dramatic shift, the finale explodes into a high-octane Skate-Punk anthem (140 BPM) with aggressive power-chord distortion and raw, unbridled vocal delivery. Featuring analog grit, tape hiss, and a live, unquantized feel, it's a sonic journey from mid-tempo swagger to a massive punk-rock climax. Perfect for teen dramas, high-energy sports sequences, and ""coming-of-age"" cinematic moments.","Experiment 93, shuNai, Indie Rock, Trip-Hop, Skate-Punk, Youthful Rebellion, Nostalgia, Female Vocals, Genre-Bending, Sudden Tempo Shift, Analog Grit, 90s Alternative, Anthemic, Skateboarding Culture, Hidden Identity, High Energy Finale.","Powerful Female Vocals, Layered Distorted Electric Guitars, Deep Sub-Bass, Driving Trip-Hop Beats, Fast Punk Drums, Atmospheric Synths, Vinyl Crackle.","High-Energy, Atmospheric., Explosive, Nostalgic, Confident, Rebellious, Self-Ironic",Alternative Hybrid / Indie Rock / Skate-Punk / Trip-Hop Noir.,"Another day, then broke the mold
To a different school, brave and bold
They saw the halo in my eyes
Expected perfection, beneath those judging skies
From the concrete jungle, where the rules would bend
To halls of privilege, a path I had to transcend
Won every game, left others in the dust
But played my own rules, driven by my own thrust
Bending rules, lost in my own head
Came back louder, words I left unsaid
On a worn-out block, my own little zone
A different world, where seeds were sown
They saw the swagger, the confident cool
Never knew the shy kid, playing by my own rule

Yeah, we were kings back then, fire in our eyes
Dreaming big and crazy, under punk rock skies!
They saw the cool facade, the confidence so loud
But the real me was hidden, lost within the crowd
Yeah, the real me was hidden, wishing they could see me now

Summer nights, filled with haze and heat
Lost in whispers, on a dead-end street
They saw the player, assumed the score
Always reaching higher, wanting something more
Radio blasting low, that slow dance beat
An anthem humming, bittersweet
A nervous glance, a touch that felt so new
Thought I had it figured out, but barely knew
That island sun, a memory burning bright
A different planet, bathed in different light
They thought I ruled the night, a rebel with a smile
But all my secrets hid, deep inside a while

Yeah, we were kings back then, fire in our eyes
Dreaming big and crazy, under punk rock skies!
They saw the cool facade, the confidence so loud
But the real me was hidden, lost within the crowd
Yeah, the real me was hidden, wishing they could see me now
See me now

Ah, the dramas back then, so intense and real
Thinking""she won't give in"" oh, the way I'd feel!
A teenage crisis, a future hanging by a thread
But tomorrow dawns, and those worries fade instead
Laughter's my best weapon, cutting through the fear
Looking back at that boy, wishing he could hear""Hey son, that's not the battle, the one that truly counts
There's a wider world waiting, with different amounts

Yeah, we were kings back then, fire in our eyes
Dreaming big and crazy, under punk rock skies!
They saw the cool facade, the confidence so loud
But the real me was hidden, lost within the crowd!
Yeah, the real me was hidden, wishing they could see me now!

See me now!
We're still kings!
Yeah yeah
Different amounts
Different amounts
Different amounts",Yes,No,yes,yes,shuNai Echoes,100.00000,Original Publisher,,shuNai Echoes 100%,shuNai,100.00000,shuNai Echoes,"Composer, Writer",shuNai 100%
65247055,The Last Petal,shuNai,shuNai Echoes,Virtue's Paradox,"Virtue's Paradox is more than an album; it is a Surgical Audit performed on the nerves of identity. As the definitive manifesto of Acoustic Brutalism, this 14-track record is built from the debris of systemic illusions and personal collapse, moving act-by-act through a deliberate five-part descent.

The Sonic Narrative:
The record transitions from the atmospheric vacuum of Acoustic Noir (The Last Petal) into the ""Chapters of Decay"" (Wolf and Jackal, VALUE$), documenting the disintegration of internal empires through Industrial Rock and Brutal Bap. The journey evolves through Glitch-Folk and nostalgic Retrospective Roots (Secret Notebook) before reaching the ""quiet-loud"" zenith of wreckage and final catharsis in the Dark Carnival of ""Curtain Call"".

The Technical Manifesto:
Driven by the principle of Biological Integrity, the album rejects the sterile perfection of modern production. Every track adheres to the RHA Protocol:

No Pitch Correction: Preserving the natural rasp, vocal fry, and raw emotional breath of the baritone delivery.

Unquantized Dynamics: Utilizing live, ""stumbling"" rhythms and aggressive industrial textures to treat audio as physical architecture.

High-Contrast Density: Achieving ""heaviness"" not through volume, but through the uncompromising density of human truth.

Virtue's Paradox offers a raw, cinematic frame for the disillusioned. It is the sound of a consciousness choosing its own fate amidst the digital dissonance of 2026.",05/28/2026,shuNai,"Alternative Rock, Epic / Hybrid / Trailer, Grunge, Rock, Soundtrack / Orchestral / Score",1,shuNai,"shuNai is a sonic architect and the founder of the Acoustic Brutalism protocol—a movement dedicated to reclaiming biological integrity in the post-AI era. His work is defined by the RHA Protocol (Resonance, Hybridity, Agency), stripping the alternative genre down to a raw, honest core of wood, steel, and human silence.

The shuNai catalog is an expansive ecosystem of ""Cinematic Noir,"" ranging from the aggressive, hybrid textures of Brutal Bap and Industrial Rock to the haunting resonance of Acoustic Noir, Trip-Hop, and Dark Neoclassical arrangements. Each composition serves as a ""Clinical Audit"" of the human condition, navigating the high-tension wires between Moral Sovereignty and Existential Collapse.

Specializing in ""Music for the Disillusioned,"" shuNai delivers high-contrast, unquantized dynamics designed for high-stakes cinematic sync and deep psychological narratives. In a world of digital saturation, his sound is a resolute ""No"" to social compliance—a transcript of a consciousness choosing its own fate.",Unspecified,,"Boom-Bap, Brutal Bap, Dark Cabaret, Dark-Folk, Drama, Epic / Hybrid / Trailer, Epic / Hybrid / Trailer, Experimental Rock, Experimental Rock, Pop Rock, Post-punk, Rap Rock, Rock, Soundtrack / Orchestral / Score",Songs,05/28/2026,05/16/2026,4:32,"A deep, hard-hitting remaster of the original single, structuralized as a tragic Acoustic Brutalism ballad with explicit folk/bard undertones. The track emphasizes an extreme ""tsunami effect"" — swinging violently from ghostly, intimate, and slurred close-mic baritone whispers over a minimal, melancholic piano melody into a devastating, chaotic climax. Driven by a prominent ticking clock motif and distorted time effects, the song explores the prison of perfect memory. A haunting, melancholic cello progression builds up right before the bridge, which then collapses into heavy, shattering drums and dissonant, broken synth textures.","Acoustic Brutalism, Deep remaster, Tsunami effect, Dark folk, Memory casket, Extreme dynamics, Ticking clock, Distorted time, Intimate whisper, Cello build-up, Raw baritone, Catharsis, Emotional breaking.","Piano (Distant/Melancholic), Cello, Clock Sounds (Ticking/Distorted), Drums (Heavy/Slamming Percussion), Synth (Soft/Dissonant Textures), Bass Guitar (Steady/Analog), SFX (Faint sigh).","Haunting, Introspective, Tragic, Poetic, Desperate, Cathartic, Dramatically Melancholic","Neoclassical, Cinematic Rock, Dark Folk, Dark Cabaret, Melancholic Indie","I remember the scent of waking skin
Smooth, unmarked by the world's softest hair
A perfect moment, trapped in amber time, I swear
Beyond all present compare

Across the decades, it feels like yesterday
This clarity, it shines and blinds, you see
A phantom limb, a scent that won't decay
A ghost that walks inside of me

And this collected past, so pure, so bright
It builds a world inside my heart
A perfect blueprint, bathed in golden light
Where shadows fear to tread

Oh, this memory's casket, lined with perfect scenes
A flawless echo, chilling to the bone
My gift, my curse, stuck somewhere in between
Forever perfectly alone
A practiced smile hides the silent, deep decay
This heavy heart, where feelings lose their way

Across the decades, it feels like yesterday
This clarity, it shines and blinds, you see
A phantom limb, a scent that won't decay
A ghost that walks inside of me

And this collected past, so pure, so bright
It builds a world inside my heart
A perfect blueprint, bathed in golden light
Where shadows fear to tread

Oh, this memory's casket, lined with perfect scenes
A flawless echo, chilling to the bone
My gift, my curse, stuck somewhere in between
Forever perfectly alone
A practiced smile hides the silent, deep decay
This heavy heart, where feelings lose their way

And the colours start to bleed, the edges start to fray
This fragile paradise consumes me from within
I tear another petal, praying it might change
The cruel design that seals me deep within
How many left before the flower turns to dust?
I dare not count, yet still I pull them one by one
This shattered mirror holds a fading, sacred gleam
And every whispered word becomes a mountain I cannot climb

Oh, this memory's casket, lined with perfect scenes
A flawless echo, beautiful and cruel
My gift, my curse, stuck somewhere in between
Forever trapped inside this golden tomb
I built this prison with my own two hands
A perfect world no living soul can touch
Now I smile through the silence, understand —
I am the ghost who loved too much

My wishes granted
My own decree
Forever bound
Eternally",Yes,No,yes,yes,shuNai Echoes,100.00000,Original Publisher,,shuNai Echoes 100%,shuNai,100.00000,,"Composer, Writer",shuNai 100%
65247056,P.S. Mentol Spit (feat. Rico Dirt),shuNai,shuNai Echoes,Virtue's Paradox,"Virtue's Paradox is more than an album; it is a Surgical Audit performed on the nerves of identity. As the definitive manifesto of Acoustic Brutalism, this 14-track record is built from the debris of systemic illusions and personal collapse, moving act-by-act through a deliberate five-part descent.

The Sonic Narrative:
The record transitions from the atmospheric vacuum of Acoustic Noir (The Last Petal) into the ""Chapters of Decay"" (Wolf and Jackal, VALUE$), documenting the disintegration of internal empires through Industrial Rock and Brutal Bap. The journey evolves through Glitch-Folk and nostalgic Retrospective Roots (Secret Notebook) before reaching the ""quiet-loud"" zenith of wreckage and final catharsis in the Dark Carnival of ""Curtain Call"".

The Technical Manifesto:
Driven by the principle of Biological Integrity, the album rejects the sterile perfection of modern production. Every track adheres to the RHA Protocol:

No Pitch Correction: Preserving the natural rasp, vocal fry, and raw emotional breath of the baritone delivery.

Unquantized Dynamics: Utilizing live, ""stumbling"" rhythms and aggressive industrial textures to treat audio as physical architecture.

High-Contrast Density: Achieving ""heaviness"" not through volume, but through the uncompromising density of human truth.

Virtue's Paradox offers a raw, cinematic frame for the disillusioned. It is the sound of a consciousness choosing its own fate amidst the digital dissonance of 2026.",05/28/2026,shuNai,"Alternative Rock, Epic / Hybrid / Trailer, Grunge, Rock, Soundtrack / Orchestral / Score",14,shuNai,"shuNai is a sonic architect and the founder of the Acoustic Brutalism protocol—a movement dedicated to reclaiming biological integrity in the post-AI era. His work is defined by the RHA Protocol (Resonance, Hybridity, Agency), stripping the alternative genre down to a raw, honest core of wood, steel, and human silence.

The shuNai catalog is an expansive ecosystem of ""Cinematic Noir,"" ranging from the aggressive, hybrid textures of Brutal Bap and Industrial Rock to the haunting resonance of Acoustic Noir, Trip-Hop, and Dark Neoclassical arrangements. Each composition serves as a ""Clinical Audit"" of the human condition, navigating the high-tension wires between Moral Sovereignty and Existential Collapse.

Specializing in ""Music for the Disillusioned,"" shuNai delivers high-contrast, unquantized dynamics designed for high-stakes cinematic sync and deep psychological narratives. In a world of digital saturation, his sound is a resolute ""No"" to social compliance—a transcript of a consciousness choosing its own fate.",Unspecified,,Unknown,Songs,05/28/2026,05/16/2026,2:53,"The final, closing track of the album. Unlike the fast, bipolar Brutal Bap version, this rendition reimagines the track as a slow-burning, heavy-hitting, and deeply hypnotic anthem while retaining its raw punk aggression. It locks into a driving, mid-tempo Everlast-style groove with a massive, swaggering bassline and gritty, swinging drums soaked in vinyl crackle. The track layers a dark, cutting Indian sitar motif and cinematic piano stabs beneath an aggressive, raw male baritone, all driven by a constant, crunchy distorted guitar hook riff. Uncompromising, dark, and full of grim, heavy punk-grunge energy.","Final chapter, Heavy groove, Slow burning, Aggressive punk rock, Raw grit, Bitter sarcasm, Sitar motif, Melancholic piano, Street wisdom, Distorted guitars, Old-school punk elements.","Electric Guitar (Heavy/Grungy Distortion), Sitar, Piano (Dark/Cinematic Stabs), Bass Guitar (Analog/Deep/Dirty), Drums (Acoustic/Heavy Swing), Vinyl Crackle.","Heavy, Angry, Dark, Hypnotic, Intense, Aggressive, Defiant, Sarcastic","Boom-Bap, Gritty Punk-Rap, Brutal Bap, Dark Hip-Hop, Grunge, Punk Rock","They turn off the light
And I'm still burning

Eyes like dead fish on a market stall
Bubblegum for the brain — their holy call
Credits, kids, Netflix on repeat
Chew the lie, feel the beat
Mirror's a stranger they refuse to meet
I still catch sunsets in dirty glass
Like it's the first time — and it lasts
They're ""grown-ups"", I'm immature
Yeah, chew and spit, you poor

Why run the race when the finish line's a lie?
Why bleed for glory when the glory's already dry?

Turn off the light, you fool!
You already did!
Turn off the light, you fool!
It's easier to live like this!
Turn off the light, you fool!
No more feeling, no more fight
Turn off the light, you fool!
Or are you already out of light?

She was fire, claws out, smile like a blade
Ripped me open just to watch the shade
Ten years later — tired mom, office drone
No spark left, just scrolling on her phone
The venom's gone, the thrill's deceased
She traded fangs for a mortgage lease
I kept the scars, I kept the flame
She chose the cage — I kept the game

Turn off the light, you fool!
Yeah, you already did!
Turn off the light, you fool!
Hide behind your fucking lid!
Turn off the light, you fool!
Kill the spark, kill the fight
Turn off the light, you fool!
Tell me — are you still alive inside?

They say I'm immature
I say I'm still breathing
They dim the light
I breathe the air full chest
Rat in the sewer?
Fine — at least I feel the stench
They hold their breath
I inhale the mess
Not today
Not yet

Turn off the light, you fool!
I'm still burning bright!
Turn off the light, you fool!
I'm still alive tonight!
Turn off the light, you fool!
You can't kill what's inside!
Turn off the light, you fool!
I'm still fucking alive!

Not today
Not yet
I'm still breathing",Yes,Yes,yes,yes,shuNai Echoes,100.00000,Original Publisher,,shuNai Echoes 100%,shuNai,100.00000,shuNai Echoes,"Composer, Writer",shuNai 100%
